{
  "artifacts": [
    {
      "media_type": "application/json",
      "path": "artifacts/release/security/vulnerabilities/governance_api-trivy.json",
      "role": "container_audit:governance_api",
      "sha256": "b7863450446738ebdb1f5fc9bb352d5da3392c21c4b4f03aaa2aa91e7c075106",
      "size_bytes": 978748
    },
    {
      "media_type": "application/json",
      "path": "artifacts/release/security/vulnerabilities/governance_web-trivy.json",
      "role": "container_audit:governance_web",
      "sha256": "ce0e231bf41ac5b8fdfe7be1966af69c67d6d9b3786503d4eff922b7cfd9eed6",
      "size_bytes": 49927
    },
    {
      "media_type": "application/vnd.cyclonedx+json",
      "path": "artifacts/release/security/sbom/governance_api-image.cdx.json",
      "role": "container_sbom:governance_api",
      "sha256": "aefb84541be7461425dc68e1e0dc943b1479d7f8f6f5d3ffb232332e2d55929f",
      "size_bytes": 277624
    },
    {
      "media_type": "application/vnd.cyclonedx+json",
      "path": "artifacts/release/security/sbom/governance_web-image.cdx.json",
      "role": "container_sbom:governance_web",
      "sha256": "6b7b8b125dffd576284f65577a75698f2ec140f5690a019d3c11926aa85757ad",
      "size_bytes": 62008
    },
    {
      "media_type": "application/json",
      "path": "artifacts/release/security/vulnerabilities/governance-web-npm-audit.json",
      "role": "npm_audit:governance_web",
      "sha256": "3546234337fadef7c7373fb96fcec99eb90d4a21ebbed41bed90bcdc1dac9732",
      "size_bytes": 364
    },
    {
      "media_type": "application/vnd.cyclonedx+json",
      "path": "artifacts/release/security/sbom/governance-web-npm.cdx.json",
      "role": "npm_sbom:governance_web",
      "sha256": "980be41c4488cee9ebaf1dff58379d65123c1bbdac36d9d42702e284639f465b",
      "size_bytes": 521933
    },
    {
      "media_type": "application/json",
      "path": "artifacts/release/security/vulnerabilities/a2a_otel_kit-pip-audit.json",
      "role": "python_audit:a2a_otel_kit",
      "sha256": "1debaf0f26fe41e347ae166b680602a55710057aff1ec86f2ca785dbd7de8765",
      "size_bytes": 5263
    },
    {
      "media_type": "application/json",
      "path": "artifacts/release/security/vulnerabilities/governance-pip-audit.json",
      "role": "python_audit:governance",
      "sha256": "43ec918fe38ec64d42c35e59ff18f62674b6d9068fef7d760071436d91cf973e",
      "size_bytes": 3900
    },
    {
      "media_type": "application/json",
      "path": "artifacts/release/security/vulnerabilities/multi_agent_credit_desk-pip-audit.json",
      "role": "python_audit:multi_agent_credit_desk",
      "sha256": "c882dbacd0d0af64cbfc18f602698ab876ce91a316cad9579d99daeff27370df",
      "size_bytes": 5154
    },
    {
      "media_type": "application/json",
      "path": "artifacts/release/security/vulnerabilities/policy_model_router-pip-audit.json",
      "role": "python_audit:policy_model_router",
      "sha256": "86f2618c638bbfbb7b478a309f34e42c8d1fa538593f4634c060787bd3f0ae1e",
      "size_bytes": 4345
    },
    {
      "media_type": "text/plain",
      "path": "artifacts/release/security/inputs/a2a_otel_kit-requirements.txt",
      "role": "python_requirements:a2a_otel_kit",
      "sha256": "298f91c47f8d98139de840e8d7b1ab9fbb96bf0aba35428dd499f953d89a80ae",
      "size_bytes": 5684
    },
    {
      "media_type": "text/plain",
      "path": "artifacts/release/security/inputs/governance-requirements.txt",
      "role": "python_requirements:governance",
      "sha256": "893fedd476fadd0e6fdd518ac7f5b0671724c344fbf4ab2d152fb960cb8d3b2b",
      "size_bytes": 4340
    },
    {
      "media_type": "text/plain",
      "path": "artifacts/release/security/inputs/multi_agent_credit_desk-requirements.txt",
      "role": "python_requirements:multi_agent_credit_desk",
      "sha256": "0f43795e43a18f74e289436e06b5133c48fbaa66d5d5958fb4c6b1e01ef94b7e",
      "size_bytes": 5797
    },
    {
      "media_type": "text/plain",
      "path": "artifacts/release/security/inputs/policy_model_router-requirements.txt",
      "role": "python_requirements:policy_model_router",
      "sha256": "acf9e9df9860b7d44a249128a508ebe721f3f76b3c53a3f6f510c15310628153",
      "size_bytes": 4572
    },
    {
      "media_type": "application/vnd.cyclonedx+json",
      "path": "artifacts/release/security/sbom/a2a_otel_kit-python.cdx.json",
      "role": "python_sbom:a2a_otel_kit",
      "sha256": "a27ce9acb8dc7e744f18c9ea5acf95db704b711e1e1069f012be6556cf9d9e0f",
      "size_bytes": 15770
    },
    {
      "media_type": "application/vnd.cyclonedx+json",
      "path": "artifacts/release/security/sbom/governance-python.cdx.json",
      "role": "python_sbom:governance",
      "sha256": "46833941cff77d09fdb3c79a5dfd91123b1bc7f7338a1b9f0268d06e1076a688",
      "size_bytes": 11741
    },
    {
      "media_type": "application/vnd.cyclonedx+json",
      "path": "artifacts/release/security/sbom/multi_agent_credit_desk-python.cdx.json",
      "role": "python_sbom:multi_agent_credit_desk",
      "sha256": "ffec718b03a7b3589572786fc4b1bcd72cb6fccdaf4684588c904a571756a383",
      "size_bytes": 15433
    },
    {
      "media_type": "application/vnd.cyclonedx+json",
      "path": "artifacts/release/security/sbom/policy_model_router-python.cdx.json",
      "role": "python_sbom:policy_model_router",
      "sha256": "b378802df3866fea1ac1e0ade587e3e8aacf4a55c83f8c9e82f4bf8b8d9a9623",
      "size_bytes": 13016
    }
  ],
  "bundle_digest": "163a5274cc59268ae59f7888a03540358a9a798fd09abdf989f8c8013838fdbd",
  "canonicalization": "json-sort-keys-compact-v1",
  "generated_at": "2026-08-11T12:20:15.042644Z",
  "images": {
    "governance_api": {
      "image_id": "sha256:aa71de514ccb4fc383f1e11ca2e9e40dc98e709cac8d6f5cf0466d8c91f780a9",
      "source_commit": "ef2c447e71638ee1cb0bedc6f39afd30bf8ba152"
    },
    "governance_web": {
      "image_id": "sha256:1968bc903e4e5648f097e7a311319109bd64de1a4983078bcf852bca6377aecd",
      "source_commit": "ef2c447e71638ee1cb0bedc6f39afd30bf8ba152"
    }
  },
  "kind": "verifiable-ai-governance/release-security-evidence",
  "policy_digest": "3dc91c8db39076a67ee27d1b1b34792f31590ea65edf647db306669708e13bf9",
  "release_manifest_digest": "0f3dec44b3db519de74745f9dd39ee7c0995dc05706635baf25aefd1a2422c0b",
  "release_version": "0.2.0-rc2",
  "schema_version": "1.0",
  "source_bindings": {
    "a2a_otel_kit": {
      "commit": "a096766fd075868704276777d847c740a17ba821",
      "lockfile_sha256": "52dc56a86d48d614d9c309898cb64232dc22597fc37f87dd427dd294fcd89c2a",
      "repository": "brunovicco/a2a-otel-kit"
    },
    "governance": {
      "commit": "ef2c447e71638ee1cb0bedc6f39afd30bf8ba152",
      "lockfile_sha256": "5b81d5e73760c51dd68c311f3c7e4c73dff99092aee22b6a139b6961b1c5d35a",
      "repository": "brunovicco/verifiable-ai-governance"
    },
    "multi_agent_credit_desk": {
      "commit": "b326971bbe7910bd94bd45c0cafbaa11a03f8610",
      "lockfile_sha256": "3d8d976b4e4d3485cb27681b028d0feed0c314a32f62943a4aea810c53c988ef",
      "repository": "brunovicco/multi-agent-credit-desk"
    },
    "policy_model_router": {
      "commit": "0344f7410fa68fbd8a61fb5d949f5d4dcf0c9166",
      "lockfile_sha256": "6faa033bfd0807c6ea6ed98930dfba708f173c5d8a044ba9504350fdf475a69f",
      "repository": "brunovicco/policy-model-router"
    }
  },
  "summaries": {
    "container:governance_api": {
      "blocking_count": 0,
      "component": "governance_api",
      "finding_count": 185,
      "findings": [
        {
          "fixed_version": "",
          "id": "CVE-2025-7458",
          "installed_version": "3.40.1-2+deb12u2",
          "package": "libsqlite3-0",
          "severity": "CRITICAL",
          "status": "observed",
          "target": "vaigov-p2-0b-governance_api:0f3dec44b3db-21149 (debian 12.15)"
        },
        {
          "fixed_version": "",
          "id": "CVE-2026-13221",
          "installed_version": "5.36.0-7+deb12u3",
          "package": "perl-base",
          "severity": "CRITICAL",
          "status": "observed",
          "target": "vaigov-p2-0b-governance_api:0f3dec44b3db-21149 (debian 12.15)"
        },
        {
          "fixed_version": "",
          "id": "CVE-2026-42496",
          "installed_version": "5.36.0-7+deb12u3",
          "package": "perl-base",
          "severity": "CRITICAL",
          "status": "observed",
          "target": "vaigov-p2-0b-governance_api:0f3dec44b3db-21149 (debian 12.15)"
        },
        {
          "fixed_version": "",
          "id": "CVE-2026-57433",
          "installed_version": "5.36.0-7+deb12u3",
          "package": "perl-base",
          "severity": "CRITICAL",
          "status": "observed",
          "target": "vaigov-p2-0b-governance_api:0f3dec44b3db-21149 (debian 12.15)"
        },
        {
          "fixed_version": "",
          "id": "CVE-2026-8376",
          "installed_version": "5.36.0-7+deb12u3",
          "package": "perl-base",
          "severity": "CRITICAL",
          "status": "observed",
          "target": "vaigov-p2-0b-governance_api:0f3dec44b3db-21149 (debian 12.15)"
        },
        {
          "fixed_version": "",
          "id": "CVE-2023-45853",
          "installed_version": "1:1.2.13.dfsg-1",
          "package": "zlib1g",
          "severity": "CRITICAL",
          "status": "observed",
          "target": "vaigov-p2-0b-governance_api:0f3dec44b3db-21149 (debian 12.15)"
        },
        {
          "fixed_version": "",
          "id": "CVE-2026-53615",
          "installed_version": "1:2.38.1-5+deb12u3",
          "package": "bsdutils",
          "severity": "HIGH",
          "status": "observed",
          "target": "vaigov-p2-0b-governance_api:0f3dec44b3db-21149 (debian 12.15)"
        },
        {
          "fixed_version": "",
          "id": "CVE-2026-41992",
          "installed_version": "1.12-1",
          "package": "gzip",
          "severity": "HIGH",
          "status": "observed",
          "target": "vaigov-p2-0b-governance_api:0f3dec44b3db-21149 (debian 12.15)"